{
  "schema_version": 2,
  "slug": "2023-06-20-03",
  "migration_record_id": "source:e046e3c0e662f960",
  "legacy_slugs": [],
  "title": "ルベーグスティルチェス積分について",
  "published_at": "2023-06-20T23:25:45+09:00",
  "sequence": 3,
  "year": 2023,
  "kind": "TeX・PDF原稿",
  "math_section": "解析・測度・確率",
  "summary": "右連続な非減少関数からLebesgue–Stieltjes測度を、表現定理と分位関数の二つの方法で構成します。実直線上のProkhorovの定理にも触れます。",
  "original_url": "https://concious4410.hatenablog.com/entry/2023/06/20/232545",
  "order": 2023062003,
  "tags": [
    "数学",
    "解析",
    "確率論",
    "測度論"
  ],
  "keywords": [
    "ルベーグスティルチェス積分について",
    "数学",
    "解析",
    "確率論",
    "測度論",
    "LS"
  ],
  "build": {
    "enabled": false,
    "engine": ""
  },
  "files": [
    {
      "path": "LS.tex",
      "role": "manuscript",
      "label": "TeXソース",
      "public": true,
      "original_sha256": "ed63555e8f5676b392687ab21d0d598bd52da2e258ca7d14b46cf187a77827d6",
      "sha256": "6f40d96b543d1f9680579bc037377eeb86118191a8b7790fce4e1a995bf47653"
    },
    {
      "path": "published.pdf",
      "role": "published-pdf",
      "label": "PDF",
      "public": true,
      "original_sha256": "04c16f1819ab7deb28c21fe0d2c166395c938523bbc5d95bb1607b8e54de1fcb",
      "sha256": "04c16f1819ab7deb28c21fe0d2c166395c938523bbc5d95bb1607b8e54de1fcb"
    },
    {
      "path": "html/LaTeXML.css",
      "role": "derived-asset",
      "label": "",
      "public": true,
      "original_sha256": "e7bbb8614cb5065aa24946d398ff8bfbe6c90c2dcffb33d76010e0470873b0b4",
      "sha256": "e7bbb8614cb5065aa24946d398ff8bfbe6c90c2dcffb33d76010e0470873b0b4"
    },
    {
      "path": "html/index.html",
      "role": "derived-html",
      "label": "HTML版を読む（自動変換・未目視）",
      "public": true,
      "original_sha256": "0ddf508370aa1ebc22a7a2bbdc1a338e0b6f5f222daa6110e80724a967566de1",
      "sha256": "0ddf508370aa1ebc22a7a2bbdc1a338e0b6f5f222daa6110e80724a967566de1"
    },
    {
      "path": "html/ltx-article.css",
      "role": "derived-asset",
      "label": "",
      "public": true,
      "original_sha256": "ff496feba79de089ccd24a97da63bb0db859b10c1c68d2d9576f402a0473a102",
      "sha256": "ff496feba79de089ccd24a97da63bb0db859b10c1c68d2d9576f402a0473a102"
    }
  ],
  "approved_changes": [
    {
      "approved_at": "2026-07-26T08:40:04+00:00",
      "reason": "LaTeXML警告で判明したTeX数式の明白な構文誤記を修正",
      "files": [
        {
          "path": "LS.tex",
          "from_sha256": "ed63555e8f5676b392687ab21d0d598bd52da2e258ca7d14b46cf187a77827d6",
          "to_sha256": "6f40d96b543d1f9680579bc037377eeb86118191a8b7790fce4e1a995bf47653"
        }
      ]
    }
  ],
  "privacy_reviews": [
    {
      "path": "LS.tex",
      "status": "reviewed",
      "reason": "",
      "source_sha256": "6f40d96b543d1f9680579bc037377eeb86118191a8b7790fce4e1a995bf47653",
      "inspection_status": "completed",
      "recorded_at": "2026-07-26T08:40:04+00:00"
    },
    {
      "path": "published.pdf",
      "status": "overridden",
      "reason": "Popplerの日本語フォント警告後、全ページ画像、TeX原稿、PDF抽出テキストとメタデータを別途確認済み",
      "source_sha256": "04c16f1819ab7deb28c21fe0d2c166395c938523bbc5d95bb1607b8e54de1fcb",
      "inspection_status": "failed",
      "recorded_at": "2026-07-17T02:08:35+00:00"
    }
  ],
  "html_versions": [
    {
      "status": "automatic",
      "generator": "LaTeXML",
      "generator_version": "latexmlc (LaTeXML version 0.8.8)",
      "generated_at": "2026-07-26T17:40:10+09:00",
      "source_path": "LS.tex",
      "source_sha256": "6f40d96b543d1f9680579bc037377eeb86118191a8b7790fce4e1a995bf47653",
      "path": "html/index.html",
      "label": "HTML版を読む（自動変換・未目視）",
      "reviewed_at": "2026-07-26T17:41:52+09:00"
    }
  ]
}
