{
  "schema_version": 2,
  "slug": "2016-07-11-01",
  "migration_record_id": "article:9faf8fa2364f1e67",
  "legacy_slugs": [],
  "title": "Sardの定理にまつわる反例と「多様体の基礎」の誤り",
  "published_at": "2016-07-11T16:35:22+09:00",
  "sequence": 1,
  "year": 2016,
  "kind": "ブログ本文のみ",
  "math_section": "位相・距離・幾何",
  "summary": "Sardの定理に必要な微分可能性の仮定を反例から検討し、『多様体の基礎』の記述について指摘した記事です。",
  "original_url": "https://concious4410.hatenablog.com/entry/2016/07/11/163522",
  "order": 2016071101,
  "tags": [
    "数学",
    "反例",
    "雑談",
    "多様体論",
    "サードの定理",
    "解析",
    "測度論"
  ],
  "keywords": [
    "Sardの定理にまつわる反例と「多様体の基礎」の誤り"
  ],
  "build": {
    "enabled": false,
    "engine": ""
  },
  "files": [],
  "approved_changes": [],
  "privacy_reviews": []
}
