{
  "schema_version": 2,
  "slug": "2015-12-21-01",
  "migration_record_id": "source:7ddeb18114a5aa5c",
  "legacy_slugs": [],
  "title": "遺伝的正規とか完全正規",
  "published_at": "2015-12-21T17:02:56+09:00",
  "sequence": 1,
  "year": 2015,
  "kind": "TeX・PDF原稿",
  "math_section": "位相・距離・幾何",
  "summary": "互いに離れた集合の分離を通じて、遺伝的正規性と完全正規性を扱います。正規性にはT1公理を仮定しません。",
  "original_url": "https://concious4410.hatenablog.com/entry/2015/12/21/170256",
  "order": 2015122101,
  "tags": [
    "数学",
    "位相空間",
    "反例",
    "正規空間"
  ],
  "keywords": [
    "遺伝的正規とか完全正規",
    "数学",
    "位相空間",
    "反例",
    "正規空間",
    "highnormality"
  ],
  "build": {
    "enabled": false,
    "engine": ""
  },
  "files": [
    {
      "path": "highnormality.tex",
      "role": "manuscript",
      "label": "TeXソース",
      "public": true,
      "original_sha256": "e7ebd09792dfb6baeea646b84678b866b77ea3fe293cdbbe7d83c8ac9aad0e31",
      "sha256": "e7ebd09792dfb6baeea646b84678b866b77ea3fe293cdbbe7d83c8ac9aad0e31"
    },
    {
      "path": "published.pdf",
      "role": "published-pdf",
      "label": "PDF",
      "public": true,
      "original_sha256": "1ec499e9795475ac618be6d918ffa962a6fec3db17f4dd3cdaf24075b58aa826",
      "sha256": "1ec499e9795475ac618be6d918ffa962a6fec3db17f4dd3cdaf24075b58aa826"
    },
    {
      "path": "html/LaTeXML.css",
      "role": "derived-asset",
      "label": "",
      "public": true,
      "original_sha256": "e7bbb8614cb5065aa24946d398ff8bfbe6c90c2dcffb33d76010e0470873b0b4",
      "sha256": "e7bbb8614cb5065aa24946d398ff8bfbe6c90c2dcffb33d76010e0470873b0b4"
    },
    {
      "path": "html/index.html",
      "role": "derived-html",
      "label": "HTML版を読む（自動変換・未目視）",
      "public": true,
      "original_sha256": "01431f072851edaed00055cb00c503267d546b2920c822d1611a6fa6a911759d",
      "sha256": "01431f072851edaed00055cb00c503267d546b2920c822d1611a6fa6a911759d"
    },
    {
      "path": "html/ltx-article.css",
      "role": "derived-asset",
      "label": "",
      "public": true,
      "original_sha256": "ff496feba79de089ccd24a97da63bb0db859b10c1c68d2d9576f402a0473a102",
      "sha256": "ff496feba79de089ccd24a97da63bb0db859b10c1c68d2d9576f402a0473a102"
    }
  ],
  "approved_changes": [],
  "privacy_reviews": [
    {
      "path": "highnormality.tex",
      "status": "overridden",
      "reason": "Popplerの日本語フォント警告後、全ページ画像、TeX原稿、PDF抽出テキストとメタデータを別途確認済み",
      "source_sha256": "e7ebd09792dfb6baeea646b84678b866b77ea3fe293cdbbe7d83c8ac9aad0e31",
      "inspection_status": "completed",
      "recorded_at": "2026-07-17T02:08:33+00:00"
    },
    {
      "path": "published.pdf",
      "status": "overridden",
      "reason": "Popplerの日本語フォント警告後、全ページ画像、TeX原稿、PDF抽出テキストとメタデータを別途確認済み",
      "source_sha256": "1ec499e9795475ac618be6d918ffa962a6fec3db17f4dd3cdaf24075b58aa826",
      "inspection_status": "failed",
      "recorded_at": "2026-07-17T02:08:33+00:00"
    }
  ],
  "html_versions": [
    {
      "status": "automatic",
      "generator": "LaTeXML",
      "generator_version": "latexmlc (LaTeXML version 0.8.8)",
      "generated_at": "2026-07-26T16:26:22+09:00",
      "source_path": "highnormality.tex",
      "source_sha256": "e7ebd09792dfb6baeea646b84678b866b77ea3fe293cdbbe7d83c8ac9aad0e31",
      "path": "html/index.html",
      "label": "HTML版を読む（自動変換・未目視）",
      "reviewed_at": "2026-07-26T16:41:31+09:00"
    }
  ]
}
