{
  "schema_version": 2,
  "slug": "2022-03-12-02",
  "migration_record_id": "source:5d04f9e3d1be960b",
  "legacy_slugs": [],
  "title": "多項式に関する一致の定理",
  "published_at": "2022-03-12T16:09:28+09:00",
  "sequence": 2,
  "year": 2022,
  "kind": "TeX・PDF原稿",
  "math_section": "代数・組合せ",
  "summary": "行列式の計算を用い、実係数多項式の零点集合が内点を持つならば多項式は恒等的に零であることを証明します。",
  "original_url": "https://concious4410.hatenablog.com/entry/2022/03/12/160928",
  "order": 2022031202,
  "tags": [
    "代数",
    "位相空間",
    "数学",
    "解析"
  ],
  "keywords": [
    "多項式に関する一致の定理",
    "代数",
    "位相空間",
    "数学",
    "解析",
    "identitythm"
  ],
  "build": {
    "enabled": false,
    "engine": ""
  },
  "files": [
    {
      "path": "identitythm.tex",
      "role": "manuscript",
      "label": "TeXソース",
      "public": true,
      "original_sha256": "43ffad718f3f68811a1fc068f70acaa0ed3af205b42a3d3883979d94d72460f1",
      "sha256": "43ffad718f3f68811a1fc068f70acaa0ed3af205b42a3d3883979d94d72460f1"
    },
    {
      "path": "published.pdf",
      "role": "published-pdf",
      "label": "PDF",
      "public": true,
      "original_sha256": "35e6536fd9b243acba847cdcc15ea28f255ed27f979cd30cb8ec9fef6ec7d35d",
      "sha256": "35e6536fd9b243acba847cdcc15ea28f255ed27f979cd30cb8ec9fef6ec7d35d"
    },
    {
      "path": "html/LaTeXML.css",
      "role": "derived-asset",
      "label": "",
      "public": true,
      "original_sha256": "e7bbb8614cb5065aa24946d398ff8bfbe6c90c2dcffb33d76010e0470873b0b4",
      "sha256": "e7bbb8614cb5065aa24946d398ff8bfbe6c90c2dcffb33d76010e0470873b0b4"
    },
    {
      "path": "html/index.html",
      "role": "derived-html",
      "label": "HTML版を読む（自動変換・未目視）",
      "public": true,
      "original_sha256": "58ca52234745094e491836a50e1d581f842d3727e44fe9d5477a0998db6e7f85",
      "sha256": "58ca52234745094e491836a50e1d581f842d3727e44fe9d5477a0998db6e7f85"
    },
    {
      "path": "html/ltx-article.css",
      "role": "derived-asset",
      "label": "",
      "public": true,
      "original_sha256": "ff496feba79de089ccd24a97da63bb0db859b10c1c68d2d9576f402a0473a102",
      "sha256": "ff496feba79de089ccd24a97da63bb0db859b10c1c68d2d9576f402a0473a102"
    }
  ],
  "approved_changes": [],
  "privacy_reviews": [
    {
      "path": "identitythm.tex",
      "status": "overridden",
      "reason": "Popplerの日本語フォント警告後、全ページ画像、TeX原稿、PDF抽出テキストとメタデータを別途確認済み",
      "source_sha256": "43ffad718f3f68811a1fc068f70acaa0ed3af205b42a3d3883979d94d72460f1",
      "inspection_status": "completed",
      "recorded_at": "2026-07-17T02:08:35+00:00"
    },
    {
      "path": "published.pdf",
      "status": "overridden",
      "reason": "Popplerの日本語フォント警告後、全ページ画像、TeX原稿、PDF抽出テキストとメタデータを別途確認済み",
      "source_sha256": "35e6536fd9b243acba847cdcc15ea28f255ed27f979cd30cb8ec9fef6ec7d35d",
      "inspection_status": "failed",
      "recorded_at": "2026-07-17T02:08:35+00:00"
    }
  ],
  "html_versions": [
    {
      "status": "automatic",
      "generator": "LaTeXML",
      "generator_version": "latexmlc (LaTeXML version 0.8.8)",
      "generated_at": "2026-07-26T16:26:22+09:00",
      "source_path": "identitythm.tex",
      "source_sha256": "43ffad718f3f68811a1fc068f70acaa0ed3af205b42a3d3883979d94d72460f1",
      "path": "html/index.html",
      "label": "HTML版を読む（自動変換・未目視）",
      "reviewed_at": "2026-07-26T16:41:31+09:00"
    }
  ]
}
