{
  "schema_version": 2,
  "slug": "2024-01-27-01",
  "migration_record_id": "source:1617d295ede3f06d",
  "legacy_slugs": [],
  "title": "ベールの範疇定理",
  "published_at": "2024-01-27T14:47:38+09:00",
  "sequence": 1,
  "year": 2024,
  "kind": "TeX・PDF",
  "math_section": "位相・距離・幾何",
  "summary": "Čech完備性を用い、コンパクトハウスドルフ空間、完備距離空間、局所コンパクトハウスドルフ空間のベール範疇定理を統一的に扱います。",
  "original_url": "https://concious4410.hatenablog.com/entry/2024/01/27/144738",
  "order": 2024012701,
  "tags": [
    "ベール空間",
    "距離空間",
    "局所コンパクト",
    "数学",
    "位相空間",
    "完全正則空間"
  ],
  "keywords": [
    "ベールの範疇定理"
  ],
  "build": {
    "enabled": false,
    "engine": ""
  },
  "files": [
    {
      "path": "main.tex",
      "role": "manuscript",
      "label": "TeXソース",
      "public": true,
      "original_sha256": "a08e4c0ec208be753fe2e65093d49ee2c2b19d11fd8a1e00b3347ddc9a0c2644",
      "sha256": "a08e4c0ec208be753fe2e65093d49ee2c2b19d11fd8a1e00b3347ddc9a0c2644"
    },
    {
      "path": "published.pdf",
      "role": "published-pdf",
      "label": "PDF",
      "public": true,
      "original_sha256": "119e1fd2e4c30e9d8447c53617c736a4ecabbd421225cf95505c42d72af393b8",
      "sha256": "119e1fd2e4c30e9d8447c53617c736a4ecabbd421225cf95505c42d72af393b8"
    },
    {
      "path": "references/bb.bib",
      "role": "bibliography",
      "label": "BibTeX：bb.bib",
      "public": true,
      "original_sha256": "b4d6dcc0de80b6e35f93cf31bd9ffe6b7bfd4882b430552cef141b1339d47984",
      "sha256": "b4d6dcc0de80b6e35f93cf31bd9ffe6b7bfd4882b430552cef141b1339d47984"
    },
    {
      "path": "references/myplaindoidoi.bst",
      "role": "bibliography-style",
      "label": "BST：myplaindoidoi.bst",
      "public": true,
      "original_sha256": "ccdacb434c1a5877b5d36f49286dee8b4d72fd8777f6dc0b216be5f2fe31ac6e",
      "sha256": "ccdacb434c1a5877b5d36f49286dee8b4d72fd8777f6dc0b216be5f2fe31ac6e"
    },
    {
      "path": "html/LaTeXML.css",
      "role": "derived-asset",
      "label": "",
      "public": true,
      "original_sha256": "e7bbb8614cb5065aa24946d398ff8bfbe6c90c2dcffb33d76010e0470873b0b4",
      "sha256": "e7bbb8614cb5065aa24946d398ff8bfbe6c90c2dcffb33d76010e0470873b0b4"
    },
    {
      "path": "html/index.html",
      "role": "derived-html",
      "label": "HTML版を読む（自動変換・未目視）",
      "public": true,
      "original_sha256": "408623e0267aaddbfd2482927e61dea364a8616e28dc54d7bfbed5f31ce1e8dc",
      "sha256": "408623e0267aaddbfd2482927e61dea364a8616e28dc54d7bfbed5f31ce1e8dc"
    },
    {
      "path": "html/ltx-article.css",
      "role": "derived-asset",
      "label": "",
      "public": true,
      "original_sha256": "ff496feba79de089ccd24a97da63bb0db859b10c1c68d2d9576f402a0473a102",
      "sha256": "ff496feba79de089ccd24a97da63bb0db859b10c1c68d2d9576f402a0473a102"
    }
  ],
  "approved_changes": [],
  "privacy_reviews": [
    {
      "path": "main.tex",
      "status": "overridden",
      "reason": "TeX原稿との対応、抽出テキストとPDFメタデータ、全ページ画像を確認済み。Popplerの日本語フォント警告のみ。",
      "source_sha256": "a08e4c0ec208be753fe2e65093d49ee2c2b19d11fd8a1e00b3347ddc9a0c2644",
      "inspection_status": "completed",
      "recorded_at": "2026-07-18T05:03:05+00:00"
    },
    {
      "path": "published.pdf",
      "status": "overridden",
      "reason": "TeX原稿との対応、抽出テキストとPDFメタデータ、全ページ画像を確認済み。Popplerの日本語フォント警告のみ。",
      "source_sha256": "119e1fd2e4c30e9d8447c53617c736a4ecabbd421225cf95505c42d72af393b8",
      "inspection_status": "failed",
      "recorded_at": "2026-07-18T05:03:05+00:00"
    }
  ],
  "html_versions": [
    {
      "status": "automatic",
      "generator": "LaTeXML",
      "generator_version": "latexmlc (LaTeXML version 0.8.8)",
      "generated_at": "2026-07-26T16:26:22+09:00",
      "source_path": "main.tex",
      "source_sha256": "a08e4c0ec208be753fe2e65093d49ee2c2b19d11fd8a1e00b3347ddc9a0c2644",
      "path": "html/index.html",
      "label": "HTML版を読む（自動変換・未目視）",
      "reviewed_at": "2026-07-26T16:41:31+09:00"
    }
  ]
}
