{
  "schema_version": 2,
  "slug": "2022-09-10-01",
  "legacy_slugs": [],
  "title": "滑らかな関数の鏡像拡張と，境界付き多様体の座標変換",
  "published_at": "2022-09-10T23:42:49+09:00",
  "sequence": 1,
  "year": 2022,
  "kind": "複雑なTeX",
  "math_section": "解析・測度・確率",
  "summary": "上半（超）平面で定義された滑らかな関数に対するSeeleyの拡張定理と、境界付き多様体の座標変換への応用を扱います。",
  "original_url": "https://concious4410.hatenablog.com/entry/2022/09/10/234249",
  "order": 2022091001,
  "tags": [
    "位相空間",
    "数学",
    "解析"
  ],
  "keywords": [
    "Seeleyの拡張定理",
    "滑らかな関数",
    "鏡像拡張",
    "上半空間",
    "上半平面",
    "境界付き多様体",
    "座標変換",
    "C∞関数"
  ],
  "build": {
    "enabled": false,
    "engine": "platex"
  },
  "files": [
    {
      "path": "extupperhalf.tex",
      "role": "manuscript",
      "label": "TeXソース",
      "public": true,
      "original_sha256": "f2f35893625c6a11cd902258a36f72aa809ae6961622b30369349c1dcfeff359",
      "sha256": "3499602ba0dcefbcba7ed2f27731894c4c533939c95bbf9de7a053ef7525a32c"
    },
    {
      "path": "published.pdf",
      "role": "published-pdf",
      "label": "",
      "public": true,
      "original_sha256": "4d23f64894a03d1177d793eadbee4d88ce6f25150583af035dda1322f24bc279",
      "sha256": "4d23f64894a03d1177d793eadbee4d88ce6f25150583af035dda1322f24bc279"
    },
    {
      "path": "html/LaTeXML.css",
      "role": "derived-asset",
      "label": "",
      "public": true,
      "original_sha256": "e7bbb8614cb5065aa24946d398ff8bfbe6c90c2dcffb33d76010e0470873b0b4",
      "sha256": "e7bbb8614cb5065aa24946d398ff8bfbe6c90c2dcffb33d76010e0470873b0b4"
    },
    {
      "path": "html/index.html",
      "role": "derived-html",
      "label": "HTML版を読む（自動変換・未目視）",
      "public": true,
      "original_sha256": "04d7152e5cd0863886b8dd5c411f6a0c8b7e3a11a0c3fc35941094db7193922f",
      "sha256": "04d7152e5cd0863886b8dd5c411f6a0c8b7e3a11a0c3fc35941094db7193922f"
    },
    {
      "path": "html/ltx-article.css",
      "role": "derived-asset",
      "label": "",
      "public": true,
      "original_sha256": "ff496feba79de089ccd24a97da63bb0db859b10c1c68d2d9576f402a0473a102",
      "sha256": "ff496feba79de089ccd24a97da63bb0db859b10c1c68d2d9576f402a0473a102"
    }
  ],
  "approved_changes": [
    {
      "approved_at": "2026-07-26T08:40:03+00:00",
      "reason": "LaTeXML警告で判明したTeX数式の明白な構文誤記を修正",
      "files": [
        {
          "path": "extupperhalf.tex",
          "from_sha256": "f2f35893625c6a11cd902258a36f72aa809ae6961622b30369349c1dcfeff359",
          "to_sha256": "3499602ba0dcefbcba7ed2f27731894c4c533939c95bbf9de7a053ef7525a32c"
        }
      ]
    }
  ],
  "privacy_reviews": [
    {
      "path": "extupperhalf.tex",
      "status": "reviewed",
      "reason": "",
      "source_sha256": "3499602ba0dcefbcba7ed2f27731894c4c533939c95bbf9de7a053ef7525a32c",
      "inspection_status": "completed",
      "recorded_at": "2026-07-26T08:40:03+00:00"
    },
    {
      "path": "published.pdf",
      "status": "overridden",
      "reason": "著者名「ナンブ キトラ」は公開可能な筆名であると本人確認済み。PDFはPopplerの日本語フォント不足により自動検査に失敗したが、Ghostscriptで全12ページを再描画し、筆名以外の氏名・メール・所属・住所がないことを目視確認済み",
      "source_sha256": "4d23f64894a03d1177d793eadbee4d88ce6f25150583af035dda1322f24bc279",
      "inspection_status": "failed",
      "recorded_at": "2026-07-16T09:34:15+00:00"
    }
  ],
  "html_version": {
    "status": "automatic",
    "generator": "LaTeXML",
    "generator_version": "latexmlc (LaTeXML version 0.8.8)",
    "generated_at": "2026-07-26T17:40:10+09:00",
    "source_path": "extupperhalf.tex",
    "source_sha256": "3499602ba0dcefbcba7ed2f27731894c4c533939c95bbf9de7a053ef7525a32c",
    "path": "html/index.html",
    "label": "HTML版を読む（自動変換・未目視）",
    "reviewed_at": "2026-07-26T17:41:52+09:00"
  }
}
