{
  "schema_version": 2,
  "slug": "2021-05-22-01",
  "migration_record_id": "source:19f46e197970c9fd",
  "legacy_slugs": [],
  "title": "対角的交叉とFodorの補題",
  "published_at": "2021-05-22T15:23:30+09:00",
  "sequence": 1,
  "year": 2021,
  "kind": "TeX・PDF原稿",
  "math_section": "その他",
  "summary": "基数上のclub集合と対角的交叉の性質を準備し、定常集合についてのFodorの補題を証明します。",
  "original_url": "https://concious4410.hatenablog.com/entry/2021/05/22/152330",
  "order": 2021052201,
  "tags": [
    "位相空間",
    "数学",
    "集合論",
    "順序数"
  ],
  "keywords": [
    "対角的交叉とFodorの補題",
    "位相空間",
    "数学",
    "集合論",
    "順序数",
    "fodor"
  ],
  "build": {
    "enabled": false,
    "engine": ""
  },
  "files": [
    {
      "path": "fodor.tex",
      "role": "manuscript",
      "label": "TeXソース",
      "public": true,
      "original_sha256": "05bc67760c06fa155c81dbe61d2612c21efde9c12c047cbe9c7cf80cbb50a28b",
      "sha256": "05bc67760c06fa155c81dbe61d2612c21efde9c12c047cbe9c7cf80cbb50a28b"
    },
    {
      "path": "published.pdf",
      "role": "published-pdf",
      "label": "PDF",
      "public": true,
      "original_sha256": "bd35cd23f18d280d8fd7cde9e44aa91968c9bb5461f382fbb8aac82aa5d90b64",
      "sha256": "bd35cd23f18d280d8fd7cde9e44aa91968c9bb5461f382fbb8aac82aa5d90b64"
    },
    {
      "path": "html/LaTeXML.css",
      "role": "derived-asset",
      "label": "",
      "public": true,
      "original_sha256": "e7bbb8614cb5065aa24946d398ff8bfbe6c90c2dcffb33d76010e0470873b0b4",
      "sha256": "e7bbb8614cb5065aa24946d398ff8bfbe6c90c2dcffb33d76010e0470873b0b4"
    },
    {
      "path": "html/index.html",
      "role": "derived-html",
      "label": "HTML版を読む（試験）",
      "public": true,
      "original_sha256": "384db161f56a7085875d2f698e759eed7a18e33772e93edffb074315edcbf1df",
      "sha256": "384db161f56a7085875d2f698e759eed7a18e33772e93edffb074315edcbf1df"
    },
    {
      "path": "html/ltx-article.css",
      "role": "derived-asset",
      "label": "",
      "public": true,
      "original_sha256": "ff496feba79de089ccd24a97da63bb0db859b10c1c68d2d9576f402a0473a102",
      "sha256": "ff496feba79de089ccd24a97da63bb0db859b10c1c68d2d9576f402a0473a102"
    }
  ],
  "approved_changes": [],
  "privacy_reviews": [
    {
      "path": "fodor.tex",
      "status": "overridden",
      "reason": "Popplerの日本語フォント警告後、全ページ画像、TeX原稿、PDF抽出テキストとメタデータを別途確認済み",
      "source_sha256": "05bc67760c06fa155c81dbe61d2612c21efde9c12c047cbe9c7cf80cbb50a28b",
      "inspection_status": "completed",
      "recorded_at": "2026-07-17T02:08:35+00:00"
    },
    {
      "path": "published.pdf",
      "status": "overridden",
      "reason": "Popplerの日本語フォント警告後、全ページ画像、TeX原稿、PDF抽出テキストとメタデータを別途確認済み",
      "source_sha256": "bd35cd23f18d280d8fd7cde9e44aa91968c9bb5461f382fbb8aac82aa5d90b64",
      "inspection_status": "failed",
      "recorded_at": "2026-07-17T02:08:35+00:00"
    }
  ],
  "html_versions": [
    {
      "status": "approved",
      "generator": "LaTeXML",
      "generator_version": "latexmlc (LaTeXML version 0.8.8)",
      "generated_at": "2026-07-26T16:18:00+09:00",
      "source_path": "fodor.tex",
      "source_sha256": "05bc67760c06fa155c81dbe61d2612c21efde9c12c047cbe9c7cf80cbb50a28b",
      "path": "html/index.html",
      "label": "HTML版を読む（試験）",
      "reviewed_at": "2026-07-26T16:20:08+09:00"
    }
  ]
}
