{
  "schema_version": 2,
  "slug": "2015-10-19-01",
  "migration_record_id": "article:5f6ca4a290d98ef8",
  "legacy_slugs": [],
  "title": "オイラーの公式と級数の絶対収束性",
  "published_at": "2015-10-19T16:17:10+09:00",
  "sequence": 1,
  "year": 2015,
  "kind": "ブログ本文のみ",
  "math_section": "解析・測度・確率",
  "summary": "指数関数と三角関数の級数表示によるオイラーの公式の証明を見直し、絶対収束性がどこで必要になるのかを考えます。",
  "original_url": "https://concious4410.hatenablog.com/entry/2015/10/19/161710",
  "order": 2015101901,
  "tags": [
    "雑談",
    "解析",
    "数学"
  ],
  "keywords": [
    "オイラーの公式と級数の絶対収束性"
  ],
  "build": {
    "enabled": false,
    "engine": ""
  },
  "files": [],
  "approved_changes": [],
  "privacy_reviews": []
}
