{
  "schema_version": 2,
  "slug": "2023-12-01-02",
  "migration_record_id": "source:b3d92b7cf0394638",
  "legacy_slugs": [],
  "title": "エブリシング・エブリウェア・オール・アット・ワンス・関数",
  "published_at": "2023-12-01T21:21:20+09:00",
  "sequence": 2,
  "year": 2023,
  "kind": "bibtexを使っている原稿",
  "math_section": "解析・測度・確率",
  "summary": "実数上の全射や至る所不連続な関数など、多様な関数の存在と構成を横断的に扱う原稿です。",
  "original_url": "https://concious4410.hatenablog.com/entry/2023/12/01/212120",
  "order": 2023120102,
  "tags": [
    "すべて",
    "位相空間",
    "数学",
    "反例",
    "解析",
    "雑談",
    "僕のお気に入り",
    "実数に関連する集合論や位相",
    "断片ではないもの"
  ],
  "keywords": [
    "エブリウェア・サージェクティブ関数",
    "everywhere surjective function",
    "全射",
    "Darboux関数",
    "至る所不連続",
    "lineability",
    "ファイバー"
  ],
  "build": {
    "enabled": false,
    "engine": "platex"
  },
  "files": [
    {
      "path": "eveeve.tex",
      "role": "manuscript",
      "label": "TeXソース",
      "public": true,
      "original_sha256": "e725189f5e24ce720ab31f092885d822f02b13e5cd338a4f3bd4d4d2889efe10",
      "sha256": "bcd1763e333c0b319fc6af71a6a0d04d108bdd3d38de4db89d49b768d2d14123"
    },
    {
      "path": "published.pdf",
      "role": "published-pdf",
      "label": "",
      "public": true,
      "original_sha256": "8d21bc5c5a4438560ded2f9453ff730c408c9112d6d8571e4be376bacf851cab",
      "sha256": "8d21bc5c5a4438560ded2f9453ff730c408c9112d6d8571e4be376bacf851cab"
    },
    {
      "path": "wef.bib",
      "role": "bibliography",
      "label": "BibTeX",
      "public": true,
      "original_sha256": "d8eb7fd72c5fe0458eb46f7e1af21d14132961a857a94edebda0e6811d1a4fc2",
      "sha256": "d8eb7fd72c5fe0458eb46f7e1af21d14132961a857a94edebda0e6811d1a4fc2"
    },
    {
      "path": "myplaindoidoi.bst",
      "role": "bibliography-style",
      "label": "BST",
      "public": true,
      "original_sha256": "ccdacb434c1a5877b5d36f49286dee8b4d72fd8777f6dc0b216be5f2fe31ac6e",
      "sha256": "ccdacb434c1a5877b5d36f49286dee8b4d72fd8777f6dc0b216be5f2fe31ac6e"
    },
    {
      "path": "html/LaTeXML.css",
      "role": "derived-asset",
      "label": "",
      "public": true,
      "original_sha256": "e7bbb8614cb5065aa24946d398ff8bfbe6c90c2dcffb33d76010e0470873b0b4",
      "sha256": "e7bbb8614cb5065aa24946d398ff8bfbe6c90c2dcffb33d76010e0470873b0b4"
    },
    {
      "path": "html/index.html",
      "role": "derived-html",
      "label": "HTML版を読む（自動変換・未目視）",
      "public": true,
      "original_sha256": "fe7ea6a0705088edee4c001e8ec81d171308ec758bc9dbdcce7648630fb237ab",
      "sha256": "fe7ea6a0705088edee4c001e8ec81d171308ec758bc9dbdcce7648630fb237ab"
    },
    {
      "path": "html/ltx-article.css",
      "role": "derived-asset",
      "label": "",
      "public": true,
      "original_sha256": "ff496feba79de089ccd24a97da63bb0db859b10c1c68d2d9576f402a0473a102",
      "sha256": "ff496feba79de089ccd24a97da63bb0db859b10c1c68d2d9576f402a0473a102"
    }
  ],
  "approved_changes": [
    {
      "approved_at": "2026-07-26T10:32:31+00:00",
      "reason": "LaTeXML変換で判明した明白なTeX誤記の修正",
      "files": [
        {
          "path": "eveeve.tex",
          "from_sha256": "e725189f5e24ce720ab31f092885d822f02b13e5cd338a4f3bd4d4d2889efe10",
          "to_sha256": "bcd1763e333c0b319fc6af71a6a0d04d108bdd3d38de4db89d49b768d2d14123"
        }
      ]
    }
  ],
  "privacy_reviews": [
    {
      "path": "eveeve.tex",
      "status": "reviewed",
      "reason": "",
      "source_sha256": "bcd1763e333c0b319fc6af71a6a0d04d108bdd3d38de4db89d49b768d2d14123",
      "inspection_status": "completed",
      "recorded_at": "2026-07-26T10:32:31+00:00"
    },
    {
      "path": "published.pdf",
      "status": "overridden",
      "reason": "TeX全文、完成PDF全23ページの画像、抽出文字、PDFメタデータ、BibTeX、BSTを確認済み。画像化の日本語フォント警告はあるが、著者表示は公開可確認済みの筆名「電波通信 ナンブ キトラ」のみで、メール・所属・住所・本名はない。",
      "source_sha256": "8d21bc5c5a4438560ded2f9453ff730c408c9112d6d8571e4be376bacf851cab",
      "inspection_status": "failed",
      "recorded_at": "2026-07-16T12:08:14+00:00"
    }
  ],
  "html_versions": [
    {
      "status": "automatic",
      "generator": "LaTeXML",
      "generator_version": "latexmlc (LaTeXML version 0.8.8)",
      "generated_at": "2026-07-26T19:28:16+09:00",
      "source_path": "eveeve.tex",
      "source_sha256": "bcd1763e333c0b319fc6af71a6a0d04d108bdd3d38de4db89d49b768d2d14123",
      "path": "html/index.html",
      "label": "HTML版を読む（自動変換・未目視）",
      "reviewed_at": "2026-07-26T19:33:23+09:00"
    }
  ]
}
