{
  "schema_version": 2,
  "slug": "2016-12-16-01",
  "migration_record_id": "article:0704fe75522db63f",
  "legacy_slugs": [],
  "title": "連結ハウスドルフ可算集合",
  "published_at": "2016-12-16T19:31:28+09:00",
  "sequence": 1,
  "year": 2016,
  "kind": "ブログ本文のみ",
  "math_section": "位相・距離・幾何",
  "summary": "台集合が可算でありながら連結かつハウスドルフとなる空間について、構成や関連研究の文献をまとめます。",
  "original_url": "https://concious4410.hatenablog.com/entry/2016/12/16/193128",
  "order": 2016121601,
  "tags": [
    "雑談",
    "数学",
    "位相空間",
    "連結空間",
    "反例",
    "可算性"
  ],
  "keywords": [
    "連結ハウスドルフ可算集合"
  ],
  "build": {
    "enabled": false,
    "engine": ""
  },
  "files": [],
  "approved_changes": [],
  "privacy_reviews": []
}
