{
  "schema_version": 2,
  "slug": "2026-03-18-01",
  "migration_record_id": "article:9a5e45293fd3b0cb",
  "legacy_slugs": [],
  "title": "バナッハ・ストーンの定理: おまけ",
  "published_at": "2026-03-18T18:12:05+09:00",
  "sequence": 1,
  "year": 2026,
  "kind": "TeX・PDF",
  "math_section": "解析・測度・確率",
  "summary": "コンパクトハウスドルフ空間上の連続関数空間から元の位相を復元するBanach–Stoneの定理を、双対空間の極点と測度を使って紹介します。",
  "original_url": "https://concious4410.hatenablog.com/entry/2026/03/18/181205",
  "order": 2026031801,
  "tags": [
    "関数解析",
    "数学",
    "線形空間",
    "完全正則空間",
    "位相空間",
    "コンパクトネス"
  ],
  "keywords": [
    "バナッハ・ストーンの定理: おまけ"
  ],
  "build": {
    "enabled": false,
    "engine": ""
  },
  "files": [
    {
      "path": "banachstone.tex",
      "role": "manuscript",
      "label": "TeXソース",
      "public": true,
      "original_sha256": "3e1cf5ec652803f79e38c98b1773c00db2f5d1386124ca170b7c4f51c7b5aa3f",
      "sha256": "6b8bb6c6a03cb36bf084cce2768a5ef523998c4109acb2e5da26b2d87d890f86"
    },
    {
      "path": "published.pdf",
      "role": "published-pdf",
      "label": "PDF",
      "public": true,
      "original_sha256": "9dd0422c464a0a6fb08fb223919364f41dbf852bbefb34b2e16fb1fcc4522329",
      "sha256": "9dd0422c464a0a6fb08fb223919364f41dbf852bbefb34b2e16fb1fcc4522329"
    },
    {
      "path": "html/LaTeXML.css",
      "role": "derived-asset",
      "label": "",
      "public": true,
      "original_sha256": "e7bbb8614cb5065aa24946d398ff8bfbe6c90c2dcffb33d76010e0470873b0b4",
      "sha256": "e7bbb8614cb5065aa24946d398ff8bfbe6c90c2dcffb33d76010e0470873b0b4"
    },
    {
      "path": "html/index.html",
      "role": "derived-html",
      "label": "HTML版を読む（自動変換・未目視）",
      "public": true,
      "original_sha256": "0c76db15d74e8da2aef26fc940906b898c9cbabc6ee4a60f394b21d0aa4dd284",
      "sha256": "0c76db15d74e8da2aef26fc940906b898c9cbabc6ee4a60f394b21d0aa4dd284"
    },
    {
      "path": "html/ltx-article.css",
      "role": "derived-asset",
      "label": "",
      "public": true,
      "original_sha256": "ff496feba79de089ccd24a97da63bb0db859b10c1c68d2d9576f402a0473a102",
      "sha256": "ff496feba79de089ccd24a97da63bb0db859b10c1c68d2d9576f402a0473a102"
    }
  ],
  "approved_changes": [
    {
      "approved_at": "2026-07-26T08:40:04+00:00",
      "reason": "LaTeXML警告で判明したTeX数式の明白な構文誤記を修正",
      "files": [
        {
          "path": "banachstone.tex",
          "from_sha256": "3e1cf5ec652803f79e38c98b1773c00db2f5d1386124ca170b7c4f51c7b5aa3f",
          "to_sha256": "6b8bb6c6a03cb36bf084cce2768a5ef523998c4109acb2e5da26b2d87d890f86"
        }
      ]
    }
  ],
  "privacy_reviews": [
    {
      "path": "banachstone.tex",
      "status": "reviewed",
      "reason": "",
      "source_sha256": "6b8bb6c6a03cb36bf084cce2768a5ef523998c4109acb2e5da26b2d87d890f86",
      "inspection_status": "completed",
      "recorded_at": "2026-07-26T08:40:04+00:00"
    },
    {
      "path": "published.pdf",
      "status": "overridden",
      "reason": "原稿、PDFメタデータ、およびGhostscriptまたは検査画像による全ページ表示を確認済み。公開可能名義のみ。",
      "source_sha256": "9dd0422c464a0a6fb08fb223919364f41dbf852bbefb34b2e16fb1fcc4522329",
      "inspection_status": "failed",
      "recorded_at": "2026-07-18T06:12:58+00:00"
    }
  ],
  "html_versions": [
    {
      "status": "automatic",
      "generator": "LaTeXML",
      "generator_version": "latexmlc (LaTeXML version 0.8.8)",
      "generated_at": "2026-07-26T17:40:10+09:00",
      "source_path": "banachstone.tex",
      "source_sha256": "6b8bb6c6a03cb36bf084cce2768a5ef523998c4109acb2e5da26b2d87d890f86",
      "path": "html/index.html",
      "label": "HTML版を読む（自動変換・未目視）",
      "reviewed_at": "2026-07-26T17:41:52+09:00"
    }
  ]
}
