{
  "schema_version": 2,
  "slug": "2015-10-28-01",
  "migration_record_id": "source:53063402327b9832",
  "legacy_slugs": [],
  "title": "リース・マルコフ・角谷の表現定理の証明（入射角16.225°の測度論入門2）",
  "published_at": "2015-10-28T21:30:25+09:00",
  "sequence": 1,
  "year": 2015,
  "kind": "TeX・PDF",
  "math_section": "解析・測度・確率",
  "summary": "局所コンパクトハウスドルフ空間上の正の線形汎関数を測度で表す、リース・マルコフ・角谷の表現定理を証明します。",
  "original_url": "https://concious4410.hatenablog.com/entry/2015/10/28/213025",
  "order": 2015102801,
  "tags": [
    "16.225",
    "位相空間",
    "数学",
    "解析",
    "測度論",
    "局所コンパクト"
  ],
  "keywords": [
    "リース・マルコフ・角谷の表現定理の証明（入射角16.225°の測度論入門2）"
  ],
  "build": {
    "enabled": false,
    "engine": ""
  },
  "files": [
    {
      "path": "main.tex",
      "role": "manuscript",
      "label": "TeXソース",
      "public": true,
      "original_sha256": "b23bc376913258cfde0cb3d664bf812f8bba3356ecd51852228b9b68d112fc37",
      "sha256": "247e2e9f033b25b40783c3fc2f27ea8ee041cba653ae8e27fd036020e139510c"
    },
    {
      "path": "published.pdf",
      "role": "published-pdf",
      "label": "PDF",
      "public": true,
      "original_sha256": "3774aa786ff6b41dab3e80f025dcf78089f2690ebdbafeb74de9b27ff15886fc",
      "sha256": "3774aa786ff6b41dab3e80f025dcf78089f2690ebdbafeb74de9b27ff15886fc"
    },
    {
      "path": "html/LaTeXML.css",
      "role": "derived-asset",
      "label": "",
      "public": true,
      "original_sha256": "e7bbb8614cb5065aa24946d398ff8bfbe6c90c2dcffb33d76010e0470873b0b4",
      "sha256": "e7bbb8614cb5065aa24946d398ff8bfbe6c90c2dcffb33d76010e0470873b0b4"
    },
    {
      "path": "html/index.html",
      "role": "derived-html",
      "label": "HTML版を読む（自動変換・未目視）",
      "public": true,
      "original_sha256": "9d28665fb2c914aaca414db7b5d039ce3a7698775ff6810ad0bcb345d3f39946",
      "sha256": "9d28665fb2c914aaca414db7b5d039ce3a7698775ff6810ad0bcb345d3f39946"
    },
    {
      "path": "html/ltx-article.css",
      "role": "derived-asset",
      "label": "",
      "public": true,
      "original_sha256": "ff496feba79de089ccd24a97da63bb0db859b10c1c68d2d9576f402a0473a102",
      "sha256": "ff496feba79de089ccd24a97da63bb0db859b10c1c68d2d9576f402a0473a102"
    }
  ],
  "approved_changes": [
    {
      "approved_at": "2026-07-26T10:32:26+00:00",
      "reason": "LaTeXML変換で判明した明白なTeX誤記の修正",
      "files": [
        {
          "path": "main.tex",
          "from_sha256": "b23bc376913258cfde0cb3d664bf812f8bba3356ecd51852228b9b68d112fc37",
          "to_sha256": "247e2e9f033b25b40783c3fc2f27ea8ee041cba653ae8e27fd036020e139510c"
        }
      ]
    }
  ],
  "privacy_reviews": [
    {
      "path": "main.tex",
      "status": "reviewed",
      "reason": "",
      "source_sha256": "247e2e9f033b25b40783c3fc2f27ea8ee041cba653ae8e27fd036020e139510c",
      "inspection_status": "completed",
      "recorded_at": "2026-07-26T10:32:26+00:00"
    },
    {
      "path": "published.pdf",
      "status": "overridden",
      "reason": "TeX原稿との対応、抽出テキストとPDFメタデータ、全ページ画像を確認済み。Popplerの日本語フォント警告のみ。",
      "source_sha256": "3774aa786ff6b41dab3e80f025dcf78089f2690ebdbafeb74de9b27ff15886fc",
      "inspection_status": "failed",
      "recorded_at": "2026-07-18T05:03:04+00:00"
    }
  ],
  "html_versions": [
    {
      "status": "automatic",
      "generator": "LaTeXML",
      "generator_version": "latexmlc (LaTeXML version 0.8.8)",
      "generated_at": "2026-07-26T19:28:16+09:00",
      "source_path": "main.tex",
      "source_sha256": "247e2e9f033b25b40783c3fc2f27ea8ee041cba653ae8e27fd036020e139510c",
      "path": "html/index.html",
      "label": "HTML版を読む（自動変換・未目視）",
      "reviewed_at": "2026-07-26T19:33:23+09:00"
    }
  ]
}
