{
  "schema_version": 1,
  "slug": "2024-01-03-01",
  "legacy_slugs": [
    "power-series-notes"
  ],
  "title": "論文メモ：Power Series",
  "published_at": "2024-01-03T23:03:12+09:00",
  "sequence": 1,
  "year": 2024,
  "kind": "BibTeX",
  "math_section": "解析・測度・確率",
  "summary": "BibTeXデータベースから文献一覧と引用番号を自動生成する軽量な原稿です。",
  "original_url": "https://concious4410.hatenablog.com/entry/2024/01/03/230312",
  "order": 2024010301,
  "tags": [
    "数学",
    "論文メモ",
    "解析",
    "実数に関連する集合論や位相"
  ],
  "keywords": [
    "Power Series",
    "冪級数",
    "多変数冪級数",
    "Faa di Brunoの公式",
    "umbral calculus"
  ],
  "build": {
    "enabled": true,
    "engine": "platex",
    "root": "main.tex"
  },
  "files": [
    {
      "path": "main.tex",
      "role": "manuscript",
      "label": "TeXソース",
      "public": true,
      "original_sha256": "2d69c397aa4948586edf06d83f290f763fc4f33f0ab1be388e655a637d17c17e",
      "sha256": "2d69c397aa4948586edf06d83f290f763fc4f33f0ab1be388e655a637d17c17e"
    },
    {
      "path": "ps.bib",
      "role": "bibliography",
      "label": "BibTeX",
      "public": true,
      "original_sha256": "ca020a204f875bb091362a2251ae93c18da7e3dca3b75d6237ffc095565f8274",
      "sha256": "ca020a204f875bb091362a2251ae93c18da7e3dca3b75d6237ffc095565f8274"
    },
    {
      "path": "myplaindoidoi.bst",
      "role": "bibliography-style",
      "label": "文献書式",
      "public": true,
      "original_sha256": "ccdacb434c1a5877b5d36f49286dee8b4d72fd8777f6dc0b216be5f2fe31ac6e",
      "sha256": "ccdacb434c1a5877b5d36f49286dee8b4d72fd8777f6dc0b216be5f2fe31ac6e"
    },
    {
      "path": "html/LaTeXML.css",
      "role": "derived-asset",
      "label": "",
      "public": true,
      "original_sha256": "e7bbb8614cb5065aa24946d398ff8bfbe6c90c2dcffb33d76010e0470873b0b4",
      "sha256": "e7bbb8614cb5065aa24946d398ff8bfbe6c90c2dcffb33d76010e0470873b0b4"
    },
    {
      "path": "html/index.html",
      "role": "derived-html",
      "label": "HTML版を読む（自動変換・未目視）",
      "public": true,
      "original_sha256": "2ac4ef31fe94d621a488b0fdc38effa73dd2cd4eb0e06538f4fc7c000a779570",
      "sha256": "2ac4ef31fe94d621a488b0fdc38effa73dd2cd4eb0e06538f4fc7c000a779570"
    },
    {
      "path": "html/ltx-article.css",
      "role": "derived-asset",
      "label": "",
      "public": true,
      "original_sha256": "ff496feba79de089ccd24a97da63bb0db859b10c1c68d2d9576f402a0473a102",
      "sha256": "ff496feba79de089ccd24a97da63bb0db859b10c1c68d2d9576f402a0473a102"
    }
  ],
  "approved_changes": [],
  "html_versions": [
    {
      "status": "automatic",
      "generator": "LaTeXML",
      "generator_version": "latexmlc (LaTeXML version 0.8.8)",
      "generated_at": "2026-07-26T16:49:09+09:00",
      "source_path": "main.tex",
      "source_sha256": "2d69c397aa4948586edf06d83f290f763fc4f33f0ab1be388e655a637d17c17e",
      "path": "html/index.html",
      "label": "HTML版を読む（自動変換・未目視）",
      "reviewed_at": "2026-07-26T17:03:30+09:00"
    }
  ]
}
