{
  "schema_version": 2,
  "slug": "2015-10-24-01",
  "migration_record_id": "source:3555e035f78493bb",
  "legacy_slugs": [],
  "title": "入射角16.225°の測度論入門:-1",
  "published_at": "2015-10-24T14:02:38+09:00",
  "sequence": 1,
  "year": 2015,
  "kind": "TeX・PDF",
  "math_section": "解析・測度・確率",
  "summary": "測度論の準備として実数に正負の無限大を加え、拡張実数の順序・演算・位相を順に定義します。",
  "original_url": "https://concious4410.hatenablog.com/entry/2015/10/24/140238",
  "order": 2015102401,
  "tags": [
    "数学",
    "解析",
    "16.225",
    "位相空間",
    "測度論"
  ],
  "keywords": [
    "入射角16.225°の測度論入門:-1"
  ],
  "build": {
    "enabled": false,
    "engine": ""
  },
  "files": [
    {
      "path": "main.tex",
      "role": "manuscript",
      "label": "TeXソース",
      "public": true,
      "original_sha256": "2a30c57ba9952f82ed9e6c28f294f62605f416ca5c879ae9ec0c0bf780e0225b",
      "sha256": "2a30c57ba9952f82ed9e6c28f294f62605f416ca5c879ae9ec0c0bf780e0225b"
    },
    {
      "path": "published.pdf",
      "role": "published-pdf",
      "label": "PDF",
      "public": true,
      "original_sha256": "0e85e2a6e7dfa209435c397a8891d40339702012fe453b8cd0b2db0f5656826f",
      "sha256": "0e85e2a6e7dfa209435c397a8891d40339702012fe453b8cd0b2db0f5656826f"
    },
    {
      "path": "html/LaTeXML.css",
      "role": "derived-asset",
      "label": "",
      "public": true,
      "original_sha256": "e7bbb8614cb5065aa24946d398ff8bfbe6c90c2dcffb33d76010e0470873b0b4",
      "sha256": "e7bbb8614cb5065aa24946d398ff8bfbe6c90c2dcffb33d76010e0470873b0b4"
    },
    {
      "path": "html/index.html",
      "role": "derived-html",
      "label": "HTML版を読む（自動変換・未目視）",
      "public": true,
      "original_sha256": "9bdae0ae43d44b07f60b046110d440a1eb71db575982edc29584b9e2cf8efc27",
      "sha256": "9bdae0ae43d44b07f60b046110d440a1eb71db575982edc29584b9e2cf8efc27"
    },
    {
      "path": "html/ltx-article.css",
      "role": "derived-asset",
      "label": "",
      "public": true,
      "original_sha256": "ff496feba79de089ccd24a97da63bb0db859b10c1c68d2d9576f402a0473a102",
      "sha256": "ff496feba79de089ccd24a97da63bb0db859b10c1c68d2d9576f402a0473a102"
    }
  ],
  "approved_changes": [],
  "privacy_reviews": [
    {
      "path": "main.tex",
      "status": "overridden",
      "reason": "TeX原稿との対応、抽出テキストとPDFメタデータ、全ページ画像を確認済み。Popplerの日本語フォント警告のみ。",
      "source_sha256": "2a30c57ba9952f82ed9e6c28f294f62605f416ca5c879ae9ec0c0bf780e0225b",
      "inspection_status": "completed",
      "recorded_at": "2026-07-18T05:03:03+00:00"
    },
    {
      "path": "published.pdf",
      "status": "overridden",
      "reason": "TeX原稿との対応、抽出テキストとPDFメタデータ、全ページ画像を確認済み。Popplerの日本語フォント警告のみ。",
      "source_sha256": "0e85e2a6e7dfa209435c397a8891d40339702012fe453b8cd0b2db0f5656826f",
      "inspection_status": "failed",
      "recorded_at": "2026-07-18T05:03:03+00:00"
    }
  ],
  "html_versions": [
    {
      "status": "automatic",
      "generator": "LaTeXML",
      "generator_version": "latexmlc (LaTeXML version 0.8.8)",
      "generated_at": "2026-07-26T16:49:09+09:00",
      "source_path": "main.tex",
      "source_sha256": "2a30c57ba9952f82ed9e6c28f294f62605f416ca5c879ae9ec0c0bf780e0225b",
      "path": "html/index.html",
      "label": "HTML版を読む（自動変換・未目視）",
      "reviewed_at": "2026-07-26T17:03:30+09:00"
    }
  ]
}
