{
  "schema_version": 2,
  "slug": "2016-11-30-01",
  "migration_record_id": "source:98d03dd488ca6a4a",
  "legacy_slugs": [],
  "title": "カントールの区間縮小法と反例",
  "published_at": "2016-11-30T17:35:28+09:00",
  "sequence": 1,
  "year": 2016,
  "kind": "TeX原稿",
  "math_section": "位相・距離・幾何",
  "summary": "カントールの区間縮小法を完備距離空間の閉集合列へ一般化し、必要な条件と反例を考えます。",
  "original_url": "https://concious4410.hatenablog.com/entry/2016/11/30/173528",
  "order": 2016113001,
  "tags": [
    "位相空間",
    "数学",
    "反例",
    "距離空間",
    "カントール",
    "可算性"
  ],
  "keywords": [
    "カントールの区間縮小法と反例",
    "位相空間",
    "数学",
    "反例",
    "距離空間",
    "カントール",
    "可算性",
    "カントールの区間縮小法と直径と反例"
  ],
  "build": {
    "enabled": false,
    "engine": ""
  },
  "files": [
    {
      "path": "カントールの区間縮小法と直径と反例.tex",
      "role": "manuscript",
      "label": "TeXソース",
      "public": true,
      "original_sha256": "79e85aa4ee0e765dad0178b51e40516764bdcc665099192ffbb8f2923f5342d1",
      "sha256": "79e85aa4ee0e765dad0178b51e40516764bdcc665099192ffbb8f2923f5342d1"
    },
    {
      "path": "published.pdf",
      "role": "published-pdf",
      "label": "PDF（2026年7月28日生成）",
      "public": true,
      "original_sha256": "ccd9d23a2473a9a7b44740b23fcb1533fd9aee8c33376fbd59fa448f55c07ba3",
      "sha256": "ccd9d23a2473a9a7b44740b23fcb1533fd9aee8c33376fbd59fa448f55c07ba3"
    },
    {
      "path": "html/LaTeXML.css",
      "role": "derived-asset",
      "label": "",
      "public": true,
      "original_sha256": "e7bbb8614cb5065aa24946d398ff8bfbe6c90c2dcffb33d76010e0470873b0b4",
      "sha256": "e7bbb8614cb5065aa24946d398ff8bfbe6c90c2dcffb33d76010e0470873b0b4"
    },
    {
      "path": "html/index.html",
      "role": "derived-html",
      "label": "HTML版を読む（自動変換・未目視）",
      "public": true,
      "original_sha256": "708eeccfc510d29aad3f9aaac285caecd29f29b71698008b610ed320919c65fe",
      "sha256": "708eeccfc510d29aad3f9aaac285caecd29f29b71698008b610ed320919c65fe"
    },
    {
      "path": "html/ltx-article.css",
      "role": "derived-asset",
      "label": "",
      "public": true,
      "original_sha256": "ff496feba79de089ccd24a97da63bb0db859b10c1c68d2d9576f402a0473a102",
      "sha256": "ff496feba79de089ccd24a97da63bb0db859b10c1c68d2d9576f402a0473a102"
    }
  ],
  "approved_changes": [],
  "privacy_reviews": [
    {
      "path": "カントールの区間縮小法と直径と反例.tex",
      "status": "overridden",
      "reason": "Popplerの日本語フォント警告後、全ページ画像、TeX原稿、PDF抽出テキストとメタデータを別途確認済み",
      "source_sha256": "79e85aa4ee0e765dad0178b51e40516764bdcc665099192ffbb8f2923f5342d1",
      "inspection_status": "completed",
      "recorded_at": "2026-07-17T02:08:34+00:00"
    },
    {
      "path": "published.pdf",
      "status": "overridden",
      "reason": "付属Popplerの日本語CMap探索が失敗したため、Ghostscriptで全ページを画像化し、日本語・数式・公開名義・2026年7月28日の日付を目視確認",
      "source_sha256": "ccd9d23a2473a9a7b44740b23fcb1533fd9aee8c33376fbd59fa448f55c07ba3",
      "inspection_status": "failed",
      "recorded_at": "2026-07-28T09:07:19+00:00"
    }
  ],
  "html_versions": [
    {
      "status": "automatic",
      "generator": "LaTeXML",
      "generator_version": "latexmlc (LaTeXML version 0.8.8)",
      "generated_at": "2026-07-26T16:49:09+09:00",
      "source_path": "カントールの区間縮小法と直径と反例.tex",
      "source_sha256": "79e85aa4ee0e765dad0178b51e40516764bdcc665099192ffbb8f2923f5342d1",
      "path": "html/index.html",
      "label": "HTML版を読む（自動変換・未目視）",
      "reviewed_at": "2026-07-26T17:03:30+09:00"
    }
  ]
}
