{
  "schema_version": 2,
  "slug": "2015-12-21-03",
  "migration_record_id": "source:f01a4c0a6b798929",
  "legacy_slugs": [],
  "title": "The Horrible lemma",
  "published_at": "2015-12-21T17:11:44+09:00",
  "sequence": 3,
  "year": 2015,
  "kind": "TeX・PDF",
  "math_section": "代数・組合せ",
  "summary": "非負整数の組からなる有限集合に対し、適切な正整数の重みを選ぶ組合せ的な補題を扱います。",
  "original_url": "https://concious4410.hatenablog.com/entry/2015/12/21/171144",
  "order": 2015122103,
  "tags": [
    "代数",
    "数学"
  ],
  "keywords": [
    "The Horrible lemma"
  ],
  "build": {
    "enabled": false,
    "engine": ""
  },
  "files": [
    {
      "path": "main.tex",
      "role": "manuscript",
      "label": "TeXソース",
      "public": true,
      "original_sha256": "7dd84230fd347d0ded00daf807c13a91a4b06cb10760232479b7961316cd695b",
      "sha256": "7dd84230fd347d0ded00daf807c13a91a4b06cb10760232479b7961316cd695b"
    },
    {
      "path": "published.pdf",
      "role": "published-pdf",
      "label": "PDF",
      "public": true,
      "original_sha256": "c12dda4746c0aaa1ccfa2ec01723624b25f673407737e499ffd5f455cc87ae85",
      "sha256": "c12dda4746c0aaa1ccfa2ec01723624b25f673407737e499ffd5f455cc87ae85"
    },
    {
      "path": "html/LaTeXML.css",
      "role": "derived-asset",
      "label": "",
      "public": true,
      "original_sha256": "e7bbb8614cb5065aa24946d398ff8bfbe6c90c2dcffb33d76010e0470873b0b4",
      "sha256": "e7bbb8614cb5065aa24946d398ff8bfbe6c90c2dcffb33d76010e0470873b0b4"
    },
    {
      "path": "html/index.html",
      "role": "derived-html",
      "label": "HTML版を読む（自動変換・未目視）",
      "public": true,
      "original_sha256": "f6372bfb67b520adcca4ea86481f3517a4caccb95fe562b92d2c7a52247d7368",
      "sha256": "f6372bfb67b520adcca4ea86481f3517a4caccb95fe562b92d2c7a52247d7368"
    },
    {
      "path": "html/ltx-article.css",
      "role": "derived-asset",
      "label": "",
      "public": true,
      "original_sha256": "ff496feba79de089ccd24a97da63bb0db859b10c1c68d2d9576f402a0473a102",
      "sha256": "ff496feba79de089ccd24a97da63bb0db859b10c1c68d2d9576f402a0473a102"
    }
  ],
  "approved_changes": [],
  "privacy_reviews": [
    {
      "path": "main.tex",
      "status": "overridden",
      "reason": "TeX原稿との対応、抽出テキストとPDFメタデータ、全ページ画像を確認済み。Popplerの日本語フォント警告のみ。",
      "source_sha256": "7dd84230fd347d0ded00daf807c13a91a4b06cb10760232479b7961316cd695b",
      "inspection_status": "completed",
      "recorded_at": "2026-07-18T05:03:04+00:00"
    },
    {
      "path": "published.pdf",
      "status": "overridden",
      "reason": "TeX原稿との対応、抽出テキストとPDFメタデータ、全ページ画像を確認済み。Popplerの日本語フォント警告のみ。",
      "source_sha256": "c12dda4746c0aaa1ccfa2ec01723624b25f673407737e499ffd5f455cc87ae85",
      "inspection_status": "failed",
      "recorded_at": "2026-07-18T05:03:04+00:00"
    }
  ],
  "html_versions": [
    {
      "status": "automatic",
      "generator": "LaTeXML",
      "generator_version": "latexmlc (LaTeXML version 0.8.8)",
      "generated_at": "2026-07-26T16:49:09+09:00",
      "source_path": "main.tex",
      "source_sha256": "7dd84230fd347d0ded00daf807c13a91a4b06cb10760232479b7961316cd695b",
      "path": "html/index.html",
      "label": "HTML版を読む（自動変換・未目視）",
      "reviewed_at": "2026-07-26T17:03:30+09:00"
    }
  ]
}
