{
  "schema_version": 2,
  "slug": "2026-04-05-01",
  "migration_record_id": "article:72281b5f8971b4ca",
  "legacy_slugs": [],
  "title": "不動点定理と同値な命題",
  "published_at": "2026-04-05T18:14:41+09:00",
  "sequence": 1,
  "year": 2026,
  "kind": "TeX・PDF",
  "math_section": "位相・距離・幾何",
  "summary": "電波通信で公開した「不動点定理と同値な命題」のTeX・PDF原稿を保存しています。",
  "original_url": "https://concious4410.hatenablog.com/entry/2026/04/05/181441",
  "order": 2026040501,
  "tags": [
    "不動点定理",
    "代数的トポロジー",
    "位相空間",
    "数学",
    "次元論"
  ],
  "keywords": [
    "不動点定理と同値な命題"
  ],
  "build": {
    "enabled": false,
    "engine": ""
  },
  "files": [
    {
      "path": "fixedpp.tex",
      "role": "manuscript",
      "label": "TeXソース",
      "public": true,
      "original_sha256": "a6c83db52c4b6acd8f783733ebb9a53e3f31a978b68f80f1b7dcffc2c839fe46",
      "sha256": "a6c83db52c4b6acd8f783733ebb9a53e3f31a978b68f80f1b7dcffc2c839fe46"
    },
    {
      "path": "published.pdf",
      "role": "published-pdf",
      "label": "PDF",
      "public": true,
      "original_sha256": "4ab233f16a6b077d51d921a6174f5acc5731b593ec8e927f56d46ed4448cd035",
      "sha256": "4ab233f16a6b077d51d921a6174f5acc5731b593ec8e927f56d46ed4448cd035"
    },
    {
      "path": "html/LaTeXML.css",
      "role": "derived-asset",
      "label": "",
      "public": true,
      "original_sha256": "e7bbb8614cb5065aa24946d398ff8bfbe6c90c2dcffb33d76010e0470873b0b4",
      "sha256": "e7bbb8614cb5065aa24946d398ff8bfbe6c90c2dcffb33d76010e0470873b0b4"
    },
    {
      "path": "html/index.html",
      "role": "derived-html",
      "label": "HTML版を読む（自動変換・未目視）",
      "public": true,
      "original_sha256": "5c4c837969a9b90fad6fc51ea9ba2e3658da7e46e0f089b6926de5833033c59f",
      "sha256": "5c4c837969a9b90fad6fc51ea9ba2e3658da7e46e0f089b6926de5833033c59f"
    },
    {
      "path": "html/ltx-article.css",
      "role": "derived-asset",
      "label": "",
      "public": true,
      "original_sha256": "ff496feba79de089ccd24a97da63bb0db859b10c1c68d2d9576f402a0473a102",
      "sha256": "ff496feba79de089ccd24a97da63bb0db859b10c1c68d2d9576f402a0473a102"
    }
  ],
  "approved_changes": [],
  "privacy_reviews": [
    {
      "path": "fixedpp.tex",
      "status": "overridden",
      "reason": "原稿、PDFメタデータ、およびGhostscriptまたは検査画像による全ページ表示を確認済み。公開可能名義のみ。",
      "source_sha256": "a6c83db52c4b6acd8f783733ebb9a53e3f31a978b68f80f1b7dcffc2c839fe46",
      "inspection_status": "completed",
      "recorded_at": "2026-07-18T06:12:58+00:00"
    },
    {
      "path": "published.pdf",
      "status": "overridden",
      "reason": "原稿、PDFメタデータ、およびGhostscriptまたは検査画像による全ページ表示を確認済み。公開可能名義のみ。",
      "source_sha256": "4ab233f16a6b077d51d921a6174f5acc5731b593ec8e927f56d46ed4448cd035",
      "inspection_status": "failed",
      "recorded_at": "2026-07-18T06:12:58+00:00"
    }
  ],
  "html_version": {
    "status": "automatic",
    "generator": "LaTeXML",
    "generator_version": "latexmlc (LaTeXML version 0.8.8)",
    "generated_at": "2026-07-26T16:26:22+09:00",
    "source_path": "fixedpp.tex",
    "source_sha256": "a6c83db52c4b6acd8f783733ebb9a53e3f31a978b68f80f1b7dcffc2c839fe46",
    "path": "html/index.html",
    "label": "HTML版を読む（自動変換・未目視）",
    "reviewed_at": "2026-07-26T16:41:31+09:00"
  }
}
