{
  "schema_version": 2,
  "slug": "2015-12-08-01",
  "migration_record_id": "source:e78ac508b66195ad",
  "legacy_slugs": [],
  "title": "ストーンチェックコンパクト化の構成",
  "published_at": "2015-12-08T16:05:08+09:00",
  "sequence": 1,
  "year": 2015,
  "kind": "TeX原稿",
  "math_section": "位相・距離・幾何",
  "summary": "完全正則ハウスドルフ空間のStone–Čechコンパクト化を構成します。構成を主題とし、細かい性質の証明は省略しています。",
  "original_url": "https://concious4410.hatenablog.com/entry/2015/12/08/160508",
  "order": 2015120801,
  "tags": [
    "コンパクトネス",
    "位相空間",
    "数学",
    "未完成シリーズ",
    "完全正則空間"
  ],
  "keywords": [
    "ストーンチェックコンパクト化の構成",
    "コンパクトネス",
    "位相空間",
    "数学",
    "未完成シリーズ",
    "完全正則空間",
    "Stonecech"
  ],
  "build": {
    "enabled": false,
    "engine": ""
  },
  "files": [
    {
      "path": "Stonecech.tex",
      "role": "manuscript",
      "label": "TeXソース",
      "public": true,
      "original_sha256": "c8ceac0a5dc8d17b21e2213d548a29bdc99c2bf4596b3e7a28cbc37f0db1e12d",
      "sha256": "4a73afbda6963ddec996e7ee453e714a59e2836fd64071828ad821bceb67686a"
    },
    {
      "path": "published.pdf",
      "role": "published-pdf",
      "label": "PDF（2026年7月28日生成）",
      "public": true,
      "original_sha256": "1dc0db03b6c8ae72611782054155fe93b42ce91c99c5f6f42f7af29cb10cf1c3",
      "sha256": "1dc0db03b6c8ae72611782054155fe93b42ce91c99c5f6f42f7af29cb10cf1c3"
    },
    {
      "path": "html/LaTeXML.css",
      "role": "derived-asset",
      "label": "",
      "public": true,
      "original_sha256": "e7bbb8614cb5065aa24946d398ff8bfbe6c90c2dcffb33d76010e0470873b0b4",
      "sha256": "e7bbb8614cb5065aa24946d398ff8bfbe6c90c2dcffb33d76010e0470873b0b4"
    },
    {
      "path": "html/index.html",
      "role": "derived-html",
      "label": "HTML版を読む（自動変換・未目視）",
      "public": true,
      "original_sha256": "89472e291c621a3fa7383fab33e049f5fa0ae2510963137594aac369ed4e9298",
      "sha256": "89472e291c621a3fa7383fab33e049f5fa0ae2510963137594aac369ed4e9298"
    },
    {
      "path": "html/ltx-article.css",
      "role": "derived-asset",
      "label": "",
      "public": true,
      "original_sha256": "ff496feba79de089ccd24a97da63bb0db859b10c1c68d2d9576f402a0473a102",
      "sha256": "ff496feba79de089ccd24a97da63bb0db859b10c1c68d2d9576f402a0473a102"
    }
  ],
  "approved_changes": [
    {
      "approved_at": "2026-07-26T10:32:26+00:00",
      "reason": "LaTeXML変換で判明した明白なTeX誤記の修正",
      "files": [
        {
          "path": "Stonecech.tex",
          "from_sha256": "c8ceac0a5dc8d17b21e2213d548a29bdc99c2bf4596b3e7a28cbc37f0db1e12d",
          "to_sha256": "4a73afbda6963ddec996e7ee453e714a59e2836fd64071828ad821bceb67686a"
        }
      ]
    }
  ],
  "privacy_reviews": [
    {
      "path": "Stonecech.tex",
      "status": "reviewed",
      "reason": "",
      "source_sha256": "4a73afbda6963ddec996e7ee453e714a59e2836fd64071828ad821bceb67686a",
      "inspection_status": "completed",
      "recorded_at": "2026-07-26T10:32:26+00:00"
    },
    {
      "path": "published.pdf",
      "status": "overridden",
      "reason": "付属Popplerの日本語CMap探索が失敗したため、Ghostscriptで全ページを画像化し、日本語・数式・公開名義・2026年7月28日の日付を目視確認",
      "source_sha256": "1dc0db03b6c8ae72611782054155fe93b42ce91c99c5f6f42f7af29cb10cf1c3",
      "inspection_status": "failed",
      "recorded_at": "2026-07-28T09:07:19+00:00"
    }
  ],
  "html_versions": [
    {
      "status": "automatic",
      "generator": "LaTeXML",
      "generator_version": "latexmlc (LaTeXML version 0.8.8)",
      "generated_at": "2026-07-26T19:28:16+09:00",
      "source_path": "Stonecech.tex",
      "source_sha256": "4a73afbda6963ddec996e7ee453e714a59e2836fd64071828ad821bceb67686a",
      "path": "html/index.html",
      "label": "HTML版を読む（自動変換・未目視）",
      "reviewed_at": "2026-07-26T19:33:23+09:00"
    }
  ]
}
