{
  "schema_version": 2,
  "slug": "2024-01-20-04",
  "migration_record_id": "source:d4dd28fa32dd135c",
  "legacy_slugs": [],
  "title": "論文メモ：サードの定理",
  "published_at": "2024-01-20T18:02:30+09:00",
  "sequence": 4,
  "year": 2024,
  "kind": "TeX・PDF原稿",
  "math_section": "解析・測度・確率",
  "summary": "Sardの定理に至る研究から、その後の拡張・反例・系・変種までをたどる論文メモです。",
  "original_url": "https://concious4410.hatenablog.com/entry/2024/01/20/180230",
  "order": 2024012004,
  "tags": [
    "僕のお気に入り",
    "論文メモ",
    "解析",
    "サードの定理"
  ],
  "keywords": [
    "論文メモ：サードの定理",
    "僕のお気に入り",
    "論文メモ",
    "解析",
    "サードの定理",
    "sard1"
  ],
  "build": {
    "enabled": false,
    "engine": ""
  },
  "files": [
    {
      "path": "sard1.tex",
      "role": "manuscript",
      "label": "TeXソース",
      "public": true,
      "original_sha256": "ed146f908fb3e7b32e473d97eae936d695b02a81543907b1fdfcf05df3795dcc",
      "sha256": "ed146f908fb3e7b32e473d97eae936d695b02a81543907b1fdfcf05df3795dcc"
    },
    {
      "path": "sard1.bib",
      "role": "bibliography",
      "label": "BibTeX",
      "public": true,
      "original_sha256": "0484d46d4d8564ad936e67af217ca6a7c327a7959062c501f2c037383539ae5e",
      "sha256": "0484d46d4d8564ad936e67af217ca6a7c327a7959062c501f2c037383539ae5e"
    },
    {
      "path": "myplaindoidoi.bst",
      "role": "bibliography-style",
      "label": "BST",
      "public": true,
      "original_sha256": "ccdacb434c1a5877b5d36f49286dee8b4d72fd8777f6dc0b216be5f2fe31ac6e",
      "sha256": "ccdacb434c1a5877b5d36f49286dee8b4d72fd8777f6dc0b216be5f2fe31ac6e"
    },
    {
      "path": "published.pdf",
      "role": "published-pdf",
      "label": "PDF",
      "public": true,
      "original_sha256": "702b9a9b341563e59de0aea7a129f94594ecfcbec76d84cc2f348eb2b68e508a",
      "sha256": "702b9a9b341563e59de0aea7a129f94594ecfcbec76d84cc2f348eb2b68e508a"
    },
    {
      "path": "html/LaTeXML.css",
      "role": "derived-asset",
      "label": "",
      "public": true,
      "original_sha256": "e7bbb8614cb5065aa24946d398ff8bfbe6c90c2dcffb33d76010e0470873b0b4",
      "sha256": "e7bbb8614cb5065aa24946d398ff8bfbe6c90c2dcffb33d76010e0470873b0b4"
    },
    {
      "path": "html/index.html",
      "role": "derived-html",
      "label": "HTML版を読む（自動変換・未目視）",
      "public": true,
      "original_sha256": "c814be7c8b03ab9c7f0d204bf3a41fa7b3da87e8c9051141ac6c001ca043fdbf",
      "sha256": "c814be7c8b03ab9c7f0d204bf3a41fa7b3da87e8c9051141ac6c001ca043fdbf"
    },
    {
      "path": "html/ltx-article.css",
      "role": "derived-asset",
      "label": "",
      "public": true,
      "original_sha256": "ff496feba79de089ccd24a97da63bb0db859b10c1c68d2d9576f402a0473a102",
      "sha256": "ff496feba79de089ccd24a97da63bb0db859b10c1c68d2d9576f402a0473a102"
    }
  ],
  "approved_changes": [],
  "privacy_reviews": [
    {
      "path": "sard1.tex",
      "status": "overridden",
      "reason": "Popplerの日本語フォント警告後、全ページ画像、TeX原稿、PDF抽出テキストとメタデータを別途確認済み",
      "source_sha256": "ed146f908fb3e7b32e473d97eae936d695b02a81543907b1fdfcf05df3795dcc",
      "inspection_status": "completed",
      "recorded_at": "2026-07-17T02:08:38+00:00"
    },
    {
      "path": "published.pdf",
      "status": "overridden",
      "reason": "Popplerの日本語フォント警告後、全ページ画像、TeX原稿、PDF抽出テキストとメタデータを別途確認済み",
      "source_sha256": "702b9a9b341563e59de0aea7a129f94594ecfcbec76d84cc2f348eb2b68e508a",
      "inspection_status": "failed",
      "recorded_at": "2026-07-17T02:08:38+00:00"
    }
  ],
  "html_versions": [
    {
      "status": "automatic",
      "generator": "LaTeXML",
      "generator_version": "latexmlc (LaTeXML version 0.8.8)",
      "generated_at": "2026-07-26T18:35:54+09:00",
      "source_path": "sard1.tex",
      "source_sha256": "ed146f908fb3e7b32e473d97eae936d695b02a81543907b1fdfcf05df3795dcc",
      "path": "html/index.html",
      "label": "HTML版を読む（自動変換・未目視）",
      "reviewed_at": "2026-07-26T18:41:28+09:00"
    }
  ]
}
