{
  "schema_version": 2,
  "slug": "2017-11-16-01",
  "migration_record_id": "source:44f5f2bb7b204f10",
  "legacy_slugs": [],
  "title": "極限集合の基本的性質の証明",
  "published_at": "2017-11-16T17:04:09+09:00",
  "sequence": 1,
  "year": 2017,
  "kind": "TeX・PDF",
  "math_section": "位相・距離・幾何",
  "summary": "写像の極限集合を定義し、点列の集積の概念を区別しながら基本的な性質を証明します。多様体の埋め込み定理の準備となる議論です。",
  "original_url": "https://concious4410.hatenablog.com/entry/2017/11/16/170409",
  "order": 2017111601,
  "tags": [
    "数学",
    "位相空間",
    "多様体論",
    "固有写像"
  ],
  "keywords": [
    "極限集合の基本的性質の証明"
  ],
  "build": {
    "enabled": false,
    "engine": ""
  },
  "files": [
    {
      "path": "main.tex",
      "role": "manuscript",
      "label": "TeXソース",
      "public": true,
      "original_sha256": "5a2011d247da2f975514779f6c78facfd3eaa2c57239716eff421c5c8952f1d2",
      "sha256": "5a2011d247da2f975514779f6c78facfd3eaa2c57239716eff421c5c8952f1d2"
    },
    {
      "path": "published.pdf",
      "role": "published-pdf",
      "label": "PDF",
      "public": true,
      "original_sha256": "fc0749c189233d7364a1daa09a438b91abf49e4bd7dfa139be67cbc76b4b672c",
      "sha256": "fc0749c189233d7364a1daa09a438b91abf49e4bd7dfa139be67cbc76b4b672c"
    },
    {
      "path": "html/LaTeXML.css",
      "role": "derived-asset",
      "label": "",
      "public": true,
      "original_sha256": "e7bbb8614cb5065aa24946d398ff8bfbe6c90c2dcffb33d76010e0470873b0b4",
      "sha256": "e7bbb8614cb5065aa24946d398ff8bfbe6c90c2dcffb33d76010e0470873b0b4"
    },
    {
      "path": "html/index.html",
      "role": "derived-html",
      "label": "HTML版を読む（自動変換・未目視）",
      "public": true,
      "original_sha256": "a38d2cb5e79af890ad68eee44737316265d3d6e37c41aa16f14458db2268c44a",
      "sha256": "a38d2cb5e79af890ad68eee44737316265d3d6e37c41aa16f14458db2268c44a"
    },
    {
      "path": "html/ltx-article.css",
      "role": "derived-asset",
      "label": "",
      "public": true,
      "original_sha256": "ff496feba79de089ccd24a97da63bb0db859b10c1c68d2d9576f402a0473a102",
      "sha256": "ff496feba79de089ccd24a97da63bb0db859b10c1c68d2d9576f402a0473a102"
    }
  ],
  "approved_changes": [],
  "privacy_reviews": [
    {
      "path": "main.tex",
      "status": "overridden",
      "reason": "TeX原稿との対応、抽出テキストとPDFメタデータ、全ページ画像を確認済み。Popplerの日本語フォント警告のみ。",
      "source_sha256": "5a2011d247da2f975514779f6c78facfd3eaa2c57239716eff421c5c8952f1d2",
      "inspection_status": "completed",
      "recorded_at": "2026-07-18T05:03:05+00:00"
    },
    {
      "path": "published.pdf",
      "status": "overridden",
      "reason": "TeX原稿との対応、抽出テキストとPDFメタデータ、全ページ画像を確認済み。Popplerの日本語フォント警告のみ。",
      "source_sha256": "fc0749c189233d7364a1daa09a438b91abf49e4bd7dfa139be67cbc76b4b672c",
      "inspection_status": "failed",
      "recorded_at": "2026-07-18T05:03:05+00:00"
    }
  ],
  "html_versions": [
    {
      "status": "automatic",
      "generator": "LaTeXML",
      "generator_version": "latexmlc (LaTeXML version 0.8.8)",
      "generated_at": "2026-07-26T16:49:09+09:00",
      "source_path": "main.tex",
      "source_sha256": "5a2011d247da2f975514779f6c78facfd3eaa2c57239716eff421c5c8952f1d2",
      "path": "html/index.html",
      "label": "HTML版を読む（自動変換・未目視）",
      "reviewed_at": "2026-07-26T17:03:30+09:00"
    }
  ]
}
